,doi,authors,title,abstract,issue
96,10.1145/3264911,"Nediyana Daskalova, Bongshin Lee, Jeff Huang, Chester Ni, Jessica Lundin",Investigating the Effectiveness of Cohort-Based Sleep Recommendations,"Existing sleep-tracking apps and devices provide simple descriptive statistics or generic recommendations for everyone. In this work, we aim to leverage cohort-based sleep data to provide recommendations to improve an individual's sleep. We report a 4-week study (N = 39) conducted to compare three alternatives: 1) no recommendation, 2) general recommendation, and 3) cohort-based recommendation, using six sleep quality metrics. For the cohort-based recommendation, recommendations were generated based on ""similar users"" using about 40 million sleep events from Microsoft Band users. Our results indicate that cohort-based systems for health recommendations can prompt a desire for behavior change inspired by social comparison and increased awareness about sleep habits. However, in order to be effective, such systems need to establish their credibility and to be able to generate cohorts based on features that are important to users. Finally, we provide further suggestions and design implications for future cohort-based recommendation systems for healthy sleep.","Volume 2 Issue 3, September 2018"
97,10.1145/3264912,"Artem Dementyev, Javier Hernandez, Inrak Choi, Sean Follmer, Joseph Paradiso",Epidermal Robots: Wearable Sensors That Climb on the Skin,"Epidermal sensing has enabled significant advancements towards the measurement and understanding of health. Most of the existing medical instruments require direct expert manipulation of a doctor, measure a single parameter, and/or have limited sensing coverage. In contrast, this work demonstrates the first epidermal robot with the ability to move over the surface of the skin and capture a large range of body parameters. In particular, we developed SkinBot, a 2x4x2 centimeter-size robot that moves over the skin surface with a two-legged suction-based locomotion. We demonstrate three of the potential medical sensing applications which include the measurement of body biopotentials (e.g., electrodermal activity, electrocardiography) through modified suction cups that serve as electrodes, skin imaging through a skin-facing camera that can capture skin anomalies, and inertial body motions through a 6-axis accelerometer and gyroscope that can capture changes of body posture and subtle cardiorespiratory vibrations.","Volume 2 Issue 3, September 2018"
98,10.1145/3264913,"Elena Di Lascio, Shkurta Gashi, Silvia Santini",Unobtrusive Assessment of Students' Emotional Engagement during Lectures Using Electrodermal Activity Sensors,"Modern wearable devices enable the continuous and unobtrusive monitoring of human physiological parameters, including heart rate and electrodermal activity. Through the definition of adequate models these parameters allow to infer the wellbeing, empathy, or engagement of humans in different contexts. In this paper, we show that off-the-shelf wearable devices can be used to unobtrusively monitor the emotional engagement of students during lectures. We propose the use of several novel features to capture students' momentary engagement and use existing methods to characterize the general arousal of students and their physiological synchrony with the teacher. To evaluate our method we collect a data set that -- after data cleaning -- contains data from 24 students, 9 teachers, and 41 lectures. Our results show that non-engaged students can be identified with high reliability. Using a Support Vector Machine, for instance, we achieve a recall of 81% -- which is a 25 percentage points improvement with respect to a Biased Random classifier. Overall, our findings may inform the design of systems that allow students to self-monitor their engagement and act upon the obtained feedback. Teachers could profit of information about non-engaged students too to perform self-reflection and to devise and evaluate methods to (re-)engage students.","Volume 2 Issue 3, September 2018"
99,10.1145/3264914,"Rizanne Elbakly, Moustafa Elhamshary, Moustafa Youssef",HyRise: A Robust and Ubiquitous Multi-Sensor Fusion-based Floor Localization System,"Floor localization is an integral part of indoor localization systems that are deployed in any typical high-rise building. Nevertheless, while many efforts have been made to detect floor change events leveraging phone-embedded sensors, there are still a number of pitfalls that need to be overcome to provide robust and accurate localization in the 3D space.
In this paper, we present HyRise: a robust and ubiquitous probabilistic crowdsourcing-based floor determination system. HyRise is a hybrid system that combines the barometer sensor and the ubiquitous Wi-Fi access points installed in the building into a probabilistic framework to identify the user's floor. In particular, HyRise incorporates a discrete Markov localization algorithm where the motion model is based on the vertical transitions detected from the sampled pressure readings and the observation model is based on the overheard Wi-Fi access points (APs) to find the most probable floor of the user. HyRise also has provisions to handle practical deployment issues including handling the inherent drift in the barometer readings, the noisy wireless environment, heterogeneous devices, among others.
HyRise is implemented on Android phones and evaluated using three different testbeds: a campus building, a shopping mall, and a residential building with different floorplan layouts and APs densities. The results show that HyRise can identify the exact user's floor correctly in 93%, 92% and 77% of the cases for the campus building, the shopping mall, and the more challenging residential building; respectively. In addition, it can identify the floor with at most 1-floor error in 100% of the cases for all three testbeds. Moreover, the floor localization accuracy outperforms that achieved by other state-of-the-art techniques by at least 79% and up to 278%. This accuracy is achieved with no training overhead, is robust to the different user devices, and is consistent in buildings with different structures and APs densities.","Volume 2 Issue 3, September 2018"
100,10.1145/3264915,"Zipei Fan, Xuan Song, Tianqi Xia, Renhe Jiang, Ryosuke Shibasaki, Ritsu Sakuramachi",Online Deep Ensemble Learning for Predicting Citywide Human Mobility,"Predicting citywide human mobility is critical to an effective management and regulation of city governance, especially during a rare event (e.g. large event such as New Year's celebration or Comiket). Classical models can effectively predict routine human mobility, but irregular mobility during a rare event (precedented or unprecedented), which is much more difficult to model, has not drawn sufficient attention. Moreover, the complexity and non-linearity of human mobility hinders a simple model from making an accurate prediction. Bearing these facts in mind, we propose a novel online gating neural network framework with two phases. In the offline training phase, we train a gated recurrent unit-based human mobility predictor for each day in our training set, while in the online predicting phase, we construct an online adaptive human mobility predictor as well as a gating neural network that switches among the pre-trained predictors and the online adaptive human predictor. Our approach was evaluated using a real-world GPS-log dataset from Tokyo and Osaka and achieved a higher prediction accuracy than baseline models.","Volume 2 Issue 3, September 2018"
101,10.1145/3264916,"Zhihan Fang, Fan Zhang, Ling Yin, Desheng Zhang",MultiCell: Urban Population Modeling Based on Multiple Cellphone Networks,"Exploring cellphone network data has been proved to be a very effective way to understand urban populations because of the high penetration rate of cellphones. However, the state-of-the-art population models driven by cellphone data are typically built upon single cellphone networks, assuming the users in a particular cellphone network used are representative of all residents in the studied city with multiple cellphone networks. This assumption usually does not hold in the real world due to strategic spatial coverages and business concentrations of cellphone companies, which lead to data biases, and thus overfitting of resultant population models. To address this issue, we design a model called MultiCell to model real-time urban populations from multiple cellphone networks with two novel techniques: (i) a network realignment technique to integrate individual cell-tower spatial distributions from multiple cellphone networks for finer granular population modeling; (ii) a data fusion technique based on cross-network training to design a population model based on multiple network data. We implement MultiCell in the Chinese city Shenzhen based on three cellphone networks with 10 million active users and their daily data records at 11 thousand cell towers. We evaluate MultiCell by comparing it to the state-of-the-art models driven by single cellphone networks, and the evaluation results show that MultiCell outperforms them by 27% in terms of accuracy. Finally, we cross-validate MultiCell with three transportation systems with more than 8 million passengers to investigate its performances.","Volume 2 Issue 3, September 2018"
102,10.1145/3264917,"Clayton Feustel, Shyamak Aggarwal, Bongshin Lee, Lauren Wilcox",People Like Me: Designing for Reflection on Aggregate Cohort Data in Personal Informatics Systems,"Increases in data complexity in personal informatics systems require new ways of contextualizing personal data to facilitate meaningful reflection. An emerging approach for providing such context includes augmenting one's personal data with the data of others ""like them"" to help individuals make sense of their data. However, we do not yet understand how an individual's self-reflection process is affected when the data of others is made available. In this paper, we investigate how people reflect on three types of personal data when presented alongside a large set of aggregated data of multiple cohorts. We conducted personal and cohort data reviews using a subset of participants from a mobile-sensing study that collected physical activity, digital social activity, and perceived stress, from 47 students over three weeks. Participants preferred to use characteristics of the data (e.g., maxima, minima) and graphical presentation (e.g., appearance of trends) along with demographic identities (e.g., age, gender) when relating to cohorts. We further characterize how participants incorporated cohort data into their self-reflection process, and conclude with discussion of the implications for personal informatics systems that leverage the data of ""people like me"" to enable meaningful reflection.","Volume 2 Issue 3, September 2018"
103,10.1145/3264918,"Yang Gao, Borui Li, Wei Wang, Wenyao Xu, Chi Zhou, Zhanpeng Jin",Watching and Safeguarding Your 3D Printer: Online Process Monitoring Against Cyber-Physical Attacks,"The increasing adoption of 3D printing in many safety and mission critical applications exposes 3D printers to a variety of cyber attacks that may result in catastrophic consequences if the printing process is compromised. For example, the mechanical properties (e.g., physical strength, thermal resistance, dimensional stability) of 3D printed objects could be significantly affected and degraded if a simple printing setting is maliciously changed. To address this challenge, this study proposes a model-free real-time online process monitoring approach that is capable of detecting and defending against the cyber-physical attacks on the firmwares of 3D printers. Specifically, we explore the potential attacks and consequences of four key printing attributes (including infill path, printing speed, layer thickness, and fan speed) and then formulate the attack models. Based on the intrinsic relation between the printing attributes and the physical observations, our defense model is established by systematically analyzing the multi-faceted, real-time measurement collected from the accelerometer, magnetometer and camera. The Kalman filter and Canny filter are used to map and estimate three aforementioned critical toolpath information that might affect the printing quality. Mel-frequency Cepstrum Coefficients are used to extract features for fan speed estimation. Experimental results show that, for a complex 3D printed design, our method can achieve 4% Hausdorff distance compared with the model dimension for infill path estimate, 6.07% Mean Absolute Percentage Error (MAPE) for speed estimate, 9.57% MAPE for layer thickness estimate, and 96.8% accuracy for fan speed identification. Our study demonstrates that, this new approach can effectively defend against the cyber-physical attacks on 3D printers and 3D printing process.","Volume 2 Issue 3, September 2018"
104,10.1145/3264919,"Cole Gleason, Alexander J. Fiannaca, Melanie Kneisel, Edward Cutrell, Meredith Ringel Morris",FootNotes: Geo-referenced Audio Annotations for Nonvisual Exploration,"The majority of information in the physical environment is conveyed visually, meaning that people with vision impairments often lack access to the shared cultural, historical, and practical features that define a city. How can someone who is blind find out about the sleek skyscrapers that dot a modern city's skyline, historic cannons that have been remade into traffic pillars, or ancient trees that uproot a neighborhood's sidewalks? We present FootNotes, a system that embeds rich textual descriptions of objects and locations in OpenStreetMap, a popular geowiki. Both sighted and blind users can annotate the physical environment with functional, visual, historical, and social descriptions. We report on the experience of ten participants with vision impairments who used a spatialized audio application to interact with these annotations while exploring a city. By sharing rich annotations of physical objects and areas, FootNotes helps people thoroughly explore a new location or serendipitously discover previously unknown features of familiar environments.","Volume 2 Issue 3, September 2018"
105,10.1145/3264920,"Manoj Gulati, Farshid Salemi Parizi, Eric Whitmire, Sidhant Gupta, Shobha Sundar Ram, Amarjeet Singh, Shwetak N. Patel",CapHarvester: A Stick-on Capacitive Energy Harvester Using Stray Electric Field from AC Power Lines,"Internet of Things (IoT) applications and platforms are becoming increasingly prevalent. Alongside this growth of smart devices comes added costs for deployment, maintenance, and the need to manage power consumption so as to reduce recurrent costs of replacing batteries. To alleviate recurrent battery replacement and maintenance, we propose a novel battery-free, stick-on capacitive energy harvester that harvests the stray electric field generated around AC power lines (110 V/230 V) without an ohmic connection to earth ground reference, thereby obviating the need for cumbersome scraping of paint on concrete walls or digging a earth ground plate. Furthermore, our harvester does not require any appliance or load to be operating on the power line and can continuously harvest power after deployment. In effect, end-users are expected to simply stick the proposed harvester onto any existing power-line cord in order to power a sensing platform. Our controlled lab measurements and real-world deployments demonstrate that our device can harvest 270.6 μJ of energy from a 14 cm long interface in 12 min. We also demonstrate several applications, such as distributed temperature monitoring, appliance state monitoring, and environmental parameter logging for indoor farming.","Volume 2 Issue 3, September 2018"
106,10.1145/3264921,"Anhong Guo, Anuraag Jain, Shomiron Ghose, Gierad Laput, Chris Harrison, Jeffrey P. Bigham",Crowd-AI Camera Sensing in the Real World,"Smart appliances with built-in cameras, such as the Nest Cam and Amazon Echo Look, are becoming pervasive. They hold the promise of bringing high fidelity, contextually rich sensing into our homes, workplaces and other environments. Despite recent and impressive advances, computer vision systems are still limited in the types of sensing questions they can answer, and more importantly, do not easily generalize across diverse human environments. In response, researchers have investigated hybrid crowd- and AI-powered methods that collect human labels to bootstrap automatic processes. However, deployments have been small and mostly confined to institutional settings, leaving open questions about the scalability and generality of the approach. In this work, we describe our iterative development of Zensors++, a full-stack crowd-AI camera-based sensing system that moves significantly beyond prior work in terms of scale, question diversity, accuracy, latency, and economic feasibility. We deployed Zensors++ in the wild, with real users, over many months and environments, generating 1.6 million answers for nearly 200 questions created by our participants, costing roughly 6/10ths of a cent per answer delivered. We share lessons learned, insights gleaned, and implications for future crowd-AI vision systems.","Volume 2 Issue 3, September 2018"
107,10.1145/3264922,"Suiming Guo, Chao Chen, Jingyuan Wang, Yaxiao Liu, Ke Xu, Daqing Zhang, Dah Ming Chiu",A Simple but Quantifiable Approach to Dynamic Price Prediction in Ride-on-demand Services Leveraging Multi-source Urban Data,"Ride-on-demand (RoD) services such as Uber and Didi are becoming increasingly popular, and in these services dynamic prices play an important role in balancing the supply and demand to benefit both drivers and passengers. However, dynamic prices also create concerns. For passengers, the ""unpredictable"" prices sometimes prevent them from making quick decisions: one may wonder if it is possible to get a lower price if s/he chooses to wait a while. It is necessary to provide more information to them, and predicting the dynamic prices is a possible solution. For the transportation industry and policy makers, there are also concerns about the relationship between RoD services and their more traditional counterparts such as metro, bus, and taxi: whether they affect each other and how.
In this paper we tackle these two concerns by predicting the dynamic prices using multi-source urban data. Price prediction could help passengers understand whether they could get a lower price in neighboring locations or within a short time, thus alleviating their concerns. The prediction is based on urban data from multiple sources, including the RoD service itself, taxi service, public transportation, weather, the map of a city, etc. We train a simple linear regression model with high-dimensional composite features to perform the prediction. By combining simple basic features into composite features, we compensate for the loss of expressiveness in a linear model due to the lack of non-linearity. Additionally, the use of multi-source data and a linear model enables us to quantify and explain the relationship between multiple means of transportation by examining the weights of different features in the model. Our hope is that the study not only serves as an accurate prediction to make passengers more satisfied, but also sheds light on the concern about the relationship between different means of transportation for either the industry or policy makers.","Volume 2 Issue 3, September 2018"
108,10.1145/3264923,"Takashi Hamatani, Moustafa Elhamshary, Akira Uchiyama, Teruo Higashino",FluidMeter: Gauging the Human Daily Fluid Intake Using Smartwatches,"Water is the most vital nutrient in the human body accounting for about 60% of the body weight. To maintain optimal health, it is important for humans to consume a sufficient amount of fluids daily. Therefore, tracking the amount of human daily fluid intake has a myriad of health applications like dehydration prevention.
In this paper, we present FluidMeter: a ubiquitous and unobtrusive system to track the amount of fluid intake leveraging the inertial sensors embedded in smartwatches. To achieve this, FluidMeter first separates the drinking activities from other human activities (playing, running, eating, etc.). Thereafter, it analyzes the sampled sensors data during the extracted drinking episodes to recognize the sequence of micro-activities (lift the bottle, sip, release the bottle) that constitute the drinking activity. Finally, it applies some machine learning algorithms on some features extracted from sampled sensor data during the sipping period to gauge the amount of fluid intake in the designated drinking episode.
FluidMeter is evaluated by collecting more than 260 hours of different human activities by 70 different participants using different smartwatch models. The results show that FluidMeter can recognize the drinking activity and its micro-activities accurately which is comparable to that achieved by the state-of-the-art techniques. Finally, FluidMeter can estimate the overall amount of fluid intake in grams accurately with a estimation error limited to 15%, highlighting its promise as a ubiquitous health service.","Volume 2 Issue 3, September 2018"
109,10.1145/3264924,"Victoria Hollis, Alon Pekurovsky, Eunika Wu, Steve Whittaker",On Being Told How We Feel: How Algorithmic Sensor Feedback Influences Emotion Perception,"Algorithms and sensors are increasingly deployed for highly personal aspects of our everyday lives. Recent work suggests people have imperfect understanding of system outputs, often assuming sophisticated capabilities and deferring to feedback. We explore how people construe algorithmic interpretations of emotional data in personal informatics systems. A survey (n=188) showed strong interest in automatic stress and emotion tracking, but many respondents expected these systems to provide objective measurements for their emotional experiences. A second study examined how algorithmic sensor feedback influences emotional self-judgments, by comparing three system framings of physiological ElectroDermal Activity data (EDA): Positive (""alert and engaged""), Negative (""stressed""), and Control (no frame) in a mixed-methods study with 64 participants. Despite users reporting strategies to test system outputs, users still deferred to feedback and their perceived emotions were significantly influenced by feedback frames. Some users overrode personal judgments, believing the system had access to privileged information about their emotions. Based on these findings, we explore design implications for personal informatics including risks of users trusting systems that seemingly ""unlock"" hidden aspects of the self. We propose design approaches that provide opportunities for future emotion-monitoring systems to exploit these framing effects, and for users to more actively construe emotional states.","Volume 2 Issue 3, September 2018"
110,10.1145/3264925,"Hande Hong, Girisha Durrel De Silva, Mun Choon Chan",CrowdProbe: Non-invasive Crowd Monitoring with Wi-Fi Probe,"Devices with integrated Wi-Fi chips broadcast beacons for network connection management purposes. Such information can be captured with inexpensive monitors and used to extract user behavior. To understand the behavior of visitors, we deployed our passive monitoring system---CrowdProbe, in a multi-floor museum for six months. We used a Hidden Markov Models (HMM) based trajectory inference algorithm to infer crowd movement using more than 1.7 million opportunistically obtained probe request frames.
However, as more devices adopt schemes to randomize their MAC addresses in the passive probe session to protect user privacy, it becomes more difficult to track crowd and understand their behavior. In this paper, we try to make use of historical transition probability to reason about the movement of those randomized devices with spatial and temporal constraints. With CrowdProbe, we are able to achieve sufficient accuracy to understand the movement of visitors carrying devices with randomized MAC addresses.","Volume 2 Issue 3, September 2018"
111,10.1145/3264926,"Hsin-Liu Cindy Kao, Abdelkareem Bedri, Kent Lyons",SkinWire: Fabricating a Self-Contained On-Skin PCB for the Hand,"Current wearable form factors often house electronics using an enclosure that is attached to the body. This form factor, while wearable, tends to protrude from the body and therefore can limit wearability. While emerging research in on-skin interfaces from the HCI and wearable communities have generated form factors with lower profiles, they often still require support by conventional electronics and associated form factors for the microprocessor, wireless communication, and battery units. In this work, we introduce SkinWire, a fabrication approach that extends the early work in on-skin interfaces to shift wearable devices from their traditional box-like forms to a fully self-contained on-skin form factor.
The Skin Wire approach starts with the placement of electronic components into individual PCB islands, which are then distributed over the body surface. The islands are connected through a novel skin-wiring approach that deposits conformal multi-stranded metallic wires on thin silicon substrates through a sewing-based technique. The process affords on-skin interfaces with the needed wiring in limited surface areas. We exemplify the capacity of this approach by shifting an IMU-based hand gesture system - which traditionally come in bulky glove-based form factors - directly onto the skin. Inspired by the emerging body art trend of body wiring, the Skin Wire approach uses readily accessible materials and affords aesthetic customization. We evaluate fabrication parameters, and conduct a user study to uncover wearability concerns.","Volume 2 Issue 3, September 2018"
