,doi,authors,title,abstract,issue
203,10.1145/3191756,"Balz Maag, Zimu Zhou, Lothar Thiele",W-Air: Enabling Personal Air Pollution Monitoring on Wearables,"Accurate, portable and personal air pollution sensing devices enable quantification of individual exposure to air pollution, personalized health advice and assistance applications. Wearables are promising (e.g., on wristbands, attached to belts or backpacks) to integrate commercial off-the-shelf gas sensors for personal air pollution sensing. Yet previous research lacks comprehensive investigations on the accuracies of air pollution sensing on wearables. In response, we proposed W-Air, an accurate personal multi-pollutant monitoring platform for wearables. We discovered that human emissions introduce non-linear interference when low-cost gas sensors are integrated into wearables, which is overlooked in existing studies. W-Air adopts a sensor-fusion calibration scheme to recover high-fidelity ambient pollutant concentrations from the human interference. It also leverages a neural network with shared hidden layers to boost calibration parameter training with fewer measurements and utilizes semi-supervised regression for calibration parameter updating with little user intervention. We prototyped W-Air on a wristband with low-cost gas sensors. Evaluations demonstrated that W-Air reports accurate measurements both with and without human interference and is able to automatically learn and adapt to new environments.","Volume 2 Issue 1, March 2018"
204,10.1145/3191757,"Alessandro Montanari, Zhao Tian, Elena Francu, Benjamin Lucas, Brian Jones, Xia Zhou, Cecilia Mascolo",Measuring Interaction Proxemics with Wearable Light Tags,"The proxemics of social interactions (e.g., body distance, relative orientation) influences many aspects of our everyday life: from patients' reactions to interaction with physicians, successes in job interviews, to effective teamwork. Traditionally, interaction proxemics has been studied via questionnaires and participant observations, imposing high burden on users, low scalability and precision, and often biases.
In this paper we present Protractor, a novel wearable technology for measuring interaction proxemics as part of non-verbal behavior cues with fine granularity. Protractor employs near-infrared light to monitor both the distance and relative body orientation of interacting users. We leverage the characteristics of near-infrared light (i.e., line-of-sight propagation) to accurately and reliably identify interactions; a pair of collocated photodiodes aid the inference of relative interaction angle and distance. We achieve robustness against temporary blockage of the light channel (e.g., by the user's hand or clothes) by designing sensor fusion algorithms that exploit inertial sensors to obviate the absence of light tracking results.
We fabricated Protractor tags and conducted real-world experiments. Results show its accuracy in tracking body distances and relative angles. The framework achieves less than 6° error 95% of the time for measuring relative body orientation and 2.3-cm - 4.9-cm mean error in estimating interaction distance. We deployed Protractor tags to track user's non-verbal behaviors when conducting collaborative group tasks. Results with 64 participants show that distance and angle data from Protractor tags can help assess individual's task role with 84.9% accuracy, and identify task timeline with 93.2% accuracy.","Volume 2 Issue 1, March 2018"
205,10.1145/3191758,"Arsalan Mosenia, Jad F. Bechara, Tao Zhang, Prateek Mittal, Mung Chiang",ProCMotive: Bringing Programmability and Connectivity into Isolated Vehicles,"In recent years, numerous vehicular technologies, e.g., cruise control and steering assistant, have been proposed and deployed to improve the driving experience, passenger safety, and vehicle performance. Despite the existence of several novel vehicular applications in the literature, there still exists a significant gap between resources needed for a variety of vehicular (in particular, data-dominant, latency-sensitive, and computationally-heavy) applications and the capabilities of already-in-market vehicles. To address this gap, different smartphone-/Cloud-based approaches have been proposed that utilize the external computational/storage resources to enable new applications. However, their acceptance and application domain are still very limited due to programmability, wireless connectivity, and performance limitations, along with several security/privacy concerns.
In this paper, we present a novel reference architecture that can potentially enable rapid development of various vehicular applications while addressing shortcomings of smartphone-/Cloud-based approaches. The architecture is formed around a core component, called SmartCore, a privacy/security-friendly programmable dongle that brings general-purpose computational and storage resources to the vehicle and hosts in-vehicle applications. Based on the proposed architecture, we develop an application development framework for vehicles, that we call ProCMotive. ProCMotive enables developers to build customized vehicular applications along the Cloud-to-edge continuum, i.e., different functions of an application can be distributed across SmartCore, the user's personal devices, and the Cloud.
In order to highlight potential benefits that the framework provides, we design and develop two different vehicular applications based on ProCMotive, namely, Amber Response and Insurance Monitor. We evaluate these applications using real-world data and compare them with state-of-the-art technologies.","Volume 2 Issue 1, March 2018"
206,10.1145/3191759,"Masato Nomiyama, Toshiki Takeuchi, Hiroyuki Onimaru, Tomohiro Tanikawa, Takuji Narumi, Michitaka Hirose",Xnavi: Travel Planning System Based on Experience Flows,"Though an increasing number of people is now involved in travel planning owing to the spread of the internet, it is still difficult for travelers to plan trips on their own. It is especially difficult for tourists using automobiles because they have several choices of accessible places. To make itineraries easily, travelers require a travel planning system that suggests two types of experiences: experiences characterizing the travel area and experiences stemming from a flow between the former experiences. Existing systems do not list specific spontaneous experiences of interest to travelers. In response, Xnavi, a travel planning system for drivers based on experience flows, is proposed, which provides these types of experiences. To recommend experience flows, Xnavi extracts experience keywords related to the travel area using natural language processing based on the TF-IDF method and also extracts flows of tourist attractions' attributes based on association analysis of driving histories. Trials of the proposed method and a user study were conducted. The results show that Xnavi is effective at suggesting experiences and satisfying tourists with their plans.","Volume 2 Issue 1, March 2018"
207,10.1145/3191760,"Pablo E. Paredes, Yijun Zhou, Nur Al-Huda Hamdan, Stephanie Balters, Elizabeth Murnane, Wendy Ju, James A. Landay",Just Breathe: In-Car Interventions for Guided Slow Breathing,"Motivated by the idea that slow breathing practices could transform the automobile commute from a depleting, mindless activity into a calming, mindful experience, we introduce the first guided slow breathing intervention for drivers. We describe a controlled in-lab experiment (N=24) that contrasts the effectiveness and impact of haptic and voice guidance modalities at slowing drivers' breathing pace, which is a known modulator of stress. The experiment was conducted in two simulated driving environments (city, highway) while driving in one of two driving modes (autonomous, manual). Results show that both haptic and voice guidance systems can reduce drivers' breathing rate and provide a sustained post-intervention effect without affecting driving safety. Subjectively, most participants (19/24) preferred the haptic stimuli as they found it more natural to follow, less distracting, and easier to engage and disengage from, compared to the voice stimuli. Finally, while most participants found guided breathing to be a positive experience, a few participants in the autonomous driving condition found slow breathing to be an unusual activity inside the car. In this paper, we discuss such considerations, offer guidelines for designing in-car breathing interventions, and propose future research that extends our work to on-road studies. Altogether, this paper serves as foundational work on guided breathing interventions for automobile drivers.","Volume 2 Issue 1, March 2018"
208,10.1145/3191761,"Gaurav Paruthi, Shriti Raj, Natalie Colabianchi, Predrag Klasnja, Mark W. Newman",Finding the Sweet Spot(s): Understanding Context to Support Physical Activity Plans,"Creating actionable plans has been shown to be helpful in promoting physical activity. However, little rèsearch has been done on how best to support the creation and execution of plans. In this paper, we interviewed 16 participants to study the role that context plays in the formulation and execution of plans for physical activity. Our findings highlight nuanced ways that contextual factors interact with each other and with individual differences to impact planning. We propose the notion of sweet spots to encapsulate how particular contextual factors converge to create optimal states for performing physical activities. The concept of sweet spots helped us to better understand the creation and execution of plans made by our participants. We present design guidelines to show how sweet spots can help support physical activity planning and guide the design of context-based tools for planning support.","Volume 2 Issue 1, March 2018"
209,10.1145/3191762,"Champika Ranasinghe, Jakub Krukar, Christian Kray",Visualizing Location Uncertainty on Mobile Devices: Cross-Cultural Differences in Perceptions and Preferences,"Location uncertainty is often ignored but a key context parameter for location-based services. The standard way of visualizing location uncertainty on mobile devices is using a concentric circle. However, the impact of different visual variables (shape, size, boundary, middle dot, color) of this standard visualization on users is not well understood. There is a potential for misinterpretation, particularly across cultures. We ran a study that was previously conducted in Germany (N=32) in Sri Lanka (N=20) to investigate how users perceive different visualizations of location uncertainty on mobile devices. In particular, we investigated the impact of the four graphic dimensions, shape, boundary, middle dot and size. We identified consistencies and inconsistencies concerning perceptions of users regarding visualizations of location uncertainty across cultures. We also quantified the impact of different visualizations on the perception of users. Based on the consistencies between different visualizations and between the two cultures, we derived guidelines for visualizing location uncertainty that help developers in aligning location uncertainty with the perceptions of users. We also highlight the need for further research on cultural differences (and similarities) regarding how visualizations of location uncertainty impact the perceptions of users.","Volume 2 Issue 1, March 2018"
210,10.1145/3191763,"Jan Riemann, Martin Schmitz, Alexander Hendrich, Max Mühlhäuser",FlowPut: Environment-Aware Interactivity for Tangible 3D Objects,"Tangible interaction has shown to be beneficial in a wide variety of scenarios since it provides more direct manipulation and haptic feedback. Further, inherently three-dimensional information is represented more naturally by a 3D object than by a flat picture on a screen. Yet, today's tangibles have often pre-defined form factors and limited input and output facilities. To overcome this issue, the combination of projection and depth cameras is used as a fast and flexible way of non-intrusively adding input and output to tangibles. However, tangibles are often quite small and hence the space for output and interaction on their surface is limited. Therefore, we propose FlowPut: an environment-aware framework that utilizes the space available on and around a tangible object for projected visual output. By means of an optimization-based layout approach, FlowPut considers the environment of the objects to avoid interference between projection and real-world objects. Moreover, we contribute an occlusion resilient object recognition and tracking for tangible objects based on their 3D model and a point-cloud based multi-touch detection, that allows sensing touches also on the side of a tangible. Flowput is validated through a series of technical experiments, a user study, and two example applications.","Volume 2 Issue 1, March 2018"
211,10.1145/3191764,"Florian Schaule, Jan Ole Johanssen, Bernd Bruegge, Vivian Loftness",Employing Consumer Wearables to Detect Office Workers' Cognitive Load for Interruption Management,"Office workers' productivity and well-being are reduced by interruptions, especially if they occur during an inconvenient moment. Interruptions in phases of high cognitive load are more disruptive than in phases of low cognitive load. Based on an explorative study, we suppose the presence of social codes that signal office workers' interruptibility. We propose a system that utilizes the cognitive load of an office worker to indicate situations suitable for interruptions. The cognitive load is inferred from office workers' physiological state measured by a consumer smartwatch. The system adapts an externally mounted smart device to indicate if the office worker is interruptible. To predict the cognitive load, we trained a classifier with ten office workers and achieved an accuracy between 66% and 86%. In order to validate the classifier's accurateness in an office setting, we performed a verification study with five office workers: We systematically triggered interruptions for each subject over an interval of half a day of office work. The classifier was able to infer the level of cognitive load for three office workers. This result supports our hypotheses that inferring cognitive load using a consumer smartwatch is a viable concept.","Volume 2 Issue 1, March 2018"
212,10.1145/3191765,"Weinan Shi, Chun Yu, Xin Yi, Zhen Li, Yuanchun Shi",TOAST: Ten-Finger Eyes-Free Typing on Touchable Surfaces,"Touch typing on flat surfaces (e.g. interactive tabletop) is challenging due to lack of tactile feedback and hand drifting. In this paper, we present TOAST, an eyes-free keyboard technique for enabling efficient touch typing on touch-sensitive surfaces. We first formalized the problem of keyboard parameter (e.g. location and size) estimation based on users' typing data. Through a user study, we then examined users' eyes-free touch typing behavior on an interactive tabletop with only asterisk feedback. We fitted the keyboard model to the typing data, results suggested that the model parameters (keyboard location and size) changed not only between different users, but also within the same user along with time. Based on the results, we proposed a Markov-Bayesian algorithm for input prediction, which considers the relative location between successive touch points within each hand respectively. Simulation results showed that based on the pooled data from all users, this model improved the top-1 accuracy of the classical statistical decoding algorithm from 86.2% to 92.1%. In a second user study, we further improved TOAST with dynamical model parameter adaptation, and evaluated users' text entry performance with TOAST using realistic text entry tasks. Participants reached a pick-up speed of 41.4 WPM with a character-level error rate of 0.6%. And with less than 10 minutes of practice, they reached 44.6 WPM without sacrificing accuracy. Participants' subjective feedback also indicated that TOAST offered a natural and efficient typing experience.","Volume 2 Issue 1, March 2018"
213,10.1145/3191766,"Vivek K. Singh, Rushil Goyal, Shenghao Wu",Riskalyzer: Inferring Individual Risk-Taking Propensity Using Phone Metadata,"An individual's risk-taking propensity is ""the stable tendency to choose options with a lower probability of success, but greater rewards"". This risk propensity plays a central role in decision making by customers as well as managers, and is a mediator in behavior associated with security, privacy, health, finance, and well-being. Most common approach to understanding an individual's risk propensity remain lab-based games and surveys. Administering such surveys and games is a manual, time, and money intensive process that is also fraught with multiple biases. Recently, smartphones are increasingly seen as large-scale sensors of human activity, recording data related to physical and social aspects of people's lives. Building on this trend we investigate the potential of passive phone-based data for automatically inferring an individual's risk propensity. Specifically, we describe a novel approach to model an individual's risk propensity based on her mobile phone usage. Based on a 10-week field + lab study involving 50 participants, we report that: (1) multiple phone-based features (e.g., average gyradius) are intricately associated with participants' risk propensity; and (2) a phone-based model outperforms demography-based models by 39% in terms of accuracy of predicting risk propensity. In organizational terms, a better understanding of risk behavior could contribute significantly to risk management programs. At the same time, such results could open doors for more nuanced understanding of the underlying human risk phenomena and their interconnections with social and mobility behavior.","Volume 2 Issue 1, March 2018"
214,10.1145/3191767,"Vijay Srinivasan, Christian Koehler, Hongxia Jin",RuleSelector: Selecting Conditional Action Rules from User Behavior Patterns,"Modern smartphones and ubiquitous computing systems collect a wealth of context data from users. Conditional action rules, as popularized by the IFTTT (If-This-Then-That) platform, are a popular way for users to automate frequently repeated tasks or receive smart reminders, due to the intelligibility and control that rules provide to users. A key drawback of IFTTT systems is that they place the burden of manually specifying action rules on the user. While multiple rule mining algorithms have been proposed in existing work to automatically discover action rules, they generate hundreds of action rules, and the problem of how to present a small subset of rules to smartphone users and allow them to interactively select action rules remains unsolved. In this work, we take the first step towards solving this problem by designing and implementing RuleSelector, the first interactive rule selection tool to allow smartphone users to browse, modify, and select action rules from a small set of summarized rules presented to the user. We propose novel rule selection metrics to address the needs of smartphone users, and analyze the performance of RuleSelector using data from 200 users. We also perform a qualitative user study in order to evaluate how users use the RuleSelector tool and perceive the selected rules, and present the insights gained and design recommendations for future rule selection systems. Our users rated the selected rules from useful to very useful, and an important finding of our study is that users prefer an interactive rule selection system such as RuleSelector that automatically suggests rules, but allows users to select and modify the suggested rules. Finally, we examine the promise of RuleSelector in other ubiquitous computing systems such as smart homes and smart TVs by applying our tool to public context datasets from these domains.","Volume 2 Issue 1, March 2018"
215,10.1145/3191768,"Jiayao Tan, Xiaoliang Wang, Cam-Tu Nguyen, Yu Shi",SilentKey: A New Authentication Framework through Ultrasonic-based Lip Reading,"This paper presents SilentKey, a new authentication framework to identify mobile device users through ultrasonic-based lip reading. The main idea is to generate ultrasonic signals from a mobile phone and analyze the fine-grained impact of mouth motions on the reflected signal. The new framework is effective since people have unique characteristics when performing mouth motions, which represent not only what people input, but also how they input. SilentKey is robust against attacks since the input cannot be recorded or imitated. We implement a prototype and demonstrate the effectiveness of the system by fifty volunteers. Such a non-intrusive identification mechanism provides a natural user interface which can also be applied by people with speaking or viewing difficulties.","Volume 2 Issue 1, March 2018"
216,10.1145/3191769,"Lie Ming Tang, Jochen Meyer, Daniel A. Epstein, Kevin Bragg, Lina Engelen, Adrian Bauman, Judy Kay",Defining Adherence: Making Sense of Physical Activity Tracker Data,"Increasingly, people are collecting detailed personal activity data from commercial trackers. Such data should be able to give important insights about their activity levels. However, people do not wear or carry tracking devices all day, every day and this means that tracker data is typically incomplete. This paper aims to provide a systematic way to take account of this incompleteness, by defining adherence, a measure of data completeness, based on how much people wore their tracker. We show the impact of different adherence definitions on 12 diverse datasets, for 753 users, with over 77,000 days with data, interspersed with over 73,000 days without data. For example, in one data set, one adherence measure gives an average step count of 6,952 where another gives 9,423. Our results show the importance of adherence when analysing and reporting activity tracker data. We provide guidelines for defining adherence, analysing its impact and reporting it along with the results of the tracker data analysis. Our key contribution is the foundation for analysis of physical activity data, to take account of data incompleteness.","Volume 2 Issue 1, March 2018"
217,10.1145/3191770,"Milka Trajkova, Francesco Cafaro",Takes Tutu to Ballet: Designing Visual and Verbal Feedback for Augmented Mirrors,"Mirrors have been a core feature in ballet studios for over five hundred years. While physical mirrors provide real-time feedback, they do not inform dancers of their errors. Thus, technologies such as motion tracking have been used to augment what a physical mirror can provide. Current augmented mirrors, however, only implement one mode of communication, usually visual, and do not provide a holistic feedback to dancers that includes all the feedback elements commonly used in ballet classes. We conducted a mixed-method study with 16 novices and 16 expert dancers in which we compared two different modes of communication (visual and verbal), two different types of feedback (value and corrective) and two levels of guidance (mirror, or no mirror). Participants' ballet technique scores were evaluated by a remote teacher on eight ballet combinations (tendue, adagio, pirouette, saute, plié, degage, frappe and battement tendue). We report quantitative and qualitative results that show how the level of guidance, mode of communication, and type of feedback, needs to be tuned in different ways for novices and experts.","Volume 2 Issue 1, March 2018"
218,10.1145/3191771,"Tran Huy Vu, Archan Misra, Quentin Roy, Kenny Choo Tsu Wei, Youngki Lee",Smartwatch-based Early Gesture Detection 8 Trajectory Tracking for Interactive Gesture-Driven Applications,"The paper explores the possibility of using wrist-worn devices (specifically, a smartwatch) to accurately track the hand movement and gestures for a new class of immersive, interactive gesture-driven applications. These interactive applications need two special features: (a) the ability to identify gestures from a continuous stream of sensor data early--i.e., even before the gesture is complete, and (b) the ability to precisely track the hand's trajectory, even though the underlying inertial sensor data is noisy. We develop a new approach that tackles these requirements by first building a HMM-based gesture recognition framework that does not need an explicit segmentation step, and then using a per-gesture trajectory tracking solution that tracks the hand movement only during these predefined gestures. Using an elaborate setup that allows us to realistically study the table-tennis related hand movements of users, we show that our approach works: (a) it can achieve 95% stroke recognition accuracy. Within 50% of gesture, it can achieve a recall value of 92% for 10 novice users and 93% for 15 experienced users from a continuous sensor stream; (b) it can track hand movement during such strokeplay with a median accuracy of 6.2 cm.","Volume 2 Issue 1, March 2018"
