,doi,authors,title,abstract,issue
0,10.1145/3314388,"Sayma Akther, Nazir Saleheen, Shahin Alan Samiei, Vivek Shetty, Emre Ertin, Santosh Kumar",mORAL: An mHealth Model for Inferring Oral Hygiene Behaviors in-the-wild Using Wrist-worn Inertial Sensors,"We address the open problem of reliably detecting oral health behaviors passively from wrist-worn inertial sensors. We present our model named mORAL (pronounced em oral) for detecting brushing and flossing behaviors, without the use of instrumented toothbrushes so that the model is applicable to brushing with still prevalent manual toothbrushes. We show that for detecting rare daily events such as toothbrushing, adopting a model that is based on identifying candidate windows based on events, rather than fixed-length timeblocks, leads to significantly higher performance. Trained and tested on 2,797 hours of sensor data collected over 192 days on 25 participants (using video annotations for ground truth labels), our brushing model achieves 100% median recall with a false positive rate of one event in every nine days of sensor wearing. The average error in estimating the start/end times of the detected event is 4.1% of the interval of the actual toothbrushing event.","Volume 3 Issue 1, March 2019"
1,10.1145/3314389,"Ling Chen, Yifang Ding, Dandan Lyu, Xiaoze Liu, Hanyu Long",Deep Multi-Task Learning Based Urban Air Quality Index Modelling,"Obtaining comprehensive air quality information can help protect human health from air pollution. Existing spatially fine-grained estimation methods and forecasting methods have the following problems: 1) Only a part of data related to air quality is considered. 2) Features are defined and extracted artificially. 3) Due to the lack of training samples, they usually cannot achieve good generalization performance. Therefore, we propose a deep multi-task learning (MTL) based urban air quality index (AQI) modelling method (PANDA). On one hand, a variety of air quality-related urban big data (meteorology, traffic, factory air pollutant emission, point of interest (POI) distribution, road network distribution, etc.) are considered. Deep neural networks are used to learn the representations of these relevant spatial and sequential data, as well as to build the correlation between AQI and these representations. On the other hand, PANDA solves spatially fine-grained AQI level estimation task and AQI forecasting task jointly, which can leverage the commonalities and differences between these two tasks to improve generalization performance. We evaluate PANDA on the dataset of Hangzhou city. The experimental results show that our method can yield a better performance compared to the state-of-the-art methods.","Volume 3 Issue 1, March 2019"
2,10.1145/3314390,"Mingshi Chen, Panlong Yang, Jie Xiong, Maotian Zhang, Youngki Lee, Chaocan Xiang, Chang Tian",Your Table Can Be an Input Panel: Acoustic-based Device-Free Interaction Recognition,"This paper explores the possibility of extending the input and interactions beyond the small screen of the mobile device onto ad hoc adjacent surfaces, e.g., a wooden tabletop with acoustic signals. While the existing finger tracking approaches employ the active acoustic signal with a fixed frequency, our proposed system Ipanel employs the acoustic signals generated by sliding of fingers on the table for tracking. Different from active signal tracking, the frequency of the finger-table generated acoustic signals keeps changing, making accurate tracking much more challenging than the traditional approaches with fix frequency signal from the speaker. Unique features are extracted by exploiting the spatio-temporal and frequency domain properties of the generated acoustic signals. The features are transformed into images and then we employ the convolutional neural network (CNN) to recognize the finger movement on the table. Ipanel is able to support not only commonly used gesture (click, flip, scroll, zoom, etc.) recognition, but also handwriting (10 numbers and 26 alphabets) recognition at high accuracies. We implement Ipanel on smartphones, and conduct extensive real environment experiments to evaluate its performance. The results validate the robustness of Ipanel, and show that it maintains high accuracies across different users with varying input behaviours (e.g., input strength, speed and region). Further, Ipanel's performance is robust against different levels of ambient noise and varying surface materials.","Volume 3 Issue 1, March 2019"
3,10.1145/3314391,"Xinlei Chen, Yu Wang, Jiayou He, Shijia Pan, Yong Li, Pei Zhang",CAP: Context-aware App Usage Prediction with Heterogeneous Graph Embedding,"Context-aware mobile application (App) usage prediction benefits a variety of applications such as precise bandwidth allocation, App launch acceleration, etc. Prior works have explored this topic through individual data profiles and contextual information. However, it is still a challenging problem because of the following three aspects: i. App usage behavior is usually influenced by multiple factors, especially temporal and spatial factors. ii. It is difficult to describe individuals' preferences, which are usually time-variant. iii. A single user's data is sparse on the spatial domain and only covers a limited number of locations. Prediction becomes more difficult when the user appears at a new location.
This paper presents CAP, a context-aware App usage prediction algorithm that takes both contextual information (location &amp; time) and attribution (App with type information) into consideration. We find that the relationships between App-location, App-time, and App-App type are essential to prediction and propose a heterogeneous graph embedding algorithm to map them into the common comparable latent space. In addition, we create a user profile for each user with App usage and trajectory history to describe the individual dynamic preference for personalized prediction. We evaluate the performance of our proposed CAP with two large-scale real-world datasets. Extensive evaluations demonstrate that CAP achieves 30% higher accuracy than a state-of-the-art method Personalized Ranking Metric Embedding (PRME) in terms of Accuracy@5. In terms of mean reciprocal rank (MRR), CAP achieves 1.5× higher than the straightforward baseline Sta and 2× higher than PRME. Our investigation enables a range of applications to benefit from such timely predictions, including network operators, service providers, and etc.","Volume 3 Issue 1, March 2019"
4,10.1145/3314392,"Ying-Yu Chen, Ziyue Li, Daniela Rosner, Alexis Hiniker",Understanding Parents' Perspectives on Mealtime Technology,"For young children, family meals are an enjoyable and developmentally useful part of daily life. Although prior work has shown that ubiquitous computing solutions can enhance children's eating habits and mealtime experiences in valuable ways, other work demonstrates that many families are hesitant to use technology in this context. This paper examines adoption barriers for technology for family meals to understand with more nuance what parents value and resist in this space. Using mixed methods, we first observed family dinnertime experiences and then surveyed 122 parents with children from two to six years old. We found that parents prefer screen-based technology over voice interfaces and smart objects, because parents perceive the latter two systems to intrude on their relationship with children. The pervasiveness of smart objects embedded at meals led parents to worry about distraction and technology dependence, while the anthropomorphization of voice interfaces led parents to worry that this technology could displace parenting relationships or disrupt interpersonal interactions among family members. Parents mindlessly applied social scripts to voice interfaces, suggesting families may be more likely to apply concerns from interpersonal interactions to voice interfaces than to other technologies. We discuss the ways different form factors appeal to and worry parents, providing designers with insights about the likelihood of adoption and acceptance.","Volume 3 Issue 1, March 2019"
5,10.1145/3314393,"Yun Cheng, Xiaoxi He, Zimu Zhou, Lothar Thiele",ICT: In-field Calibration Transfer for Air Quality Sensor Deployments,"Recent years have witnessed a growing interest in urban air pollution monitoring, where hundreds of low-cost air quality sensors are deployed city-wide. To guarantee data accuracy and consistency, these sensors need periodic calibration after deployment. Since access to ground truth references is often limited in large-scale deployments, it is difficult to conduct city-wide post-deployment sensor calibration. In this work we propose In-field Calibration Transfer (ICT), a calibration scheme that transfers the calibration parameters of source sensors (with access to references) to target sensors (without access to references). On observing that (i) the distributions of ground truth in both source and target locations are similar and (ii) the transformation is approximately linear, ICT derives the transformation based on the similarity of distributions with a novel optimization formulation. The performance of ICT is further improved by exploiting spatial prediction of air quality levels and multi-source fusion. Experiments show that ICT is able to calibrate the target sensors as if they had direct access to the references.","Volume 3 Issue 1, March 2019"
6,10.1145/3314394,"Chia-Fang Chung, Qiaosi Wang, Jessica Schroeder, Allison Cole, Jasmine Zia, James Fogarty, Sean A. Munson",Identifying and Planning for Individualized Change: Patient-Provider Collaboration Using Lightweight Food Diaries in Healthy Eating and Irritable Bowel Syndrome,"Identifying and planning strategies that support a healthy lifestyle or manage a chronic disease often require patient-provider collaboration. For example, people with healthy eating goals often share everyday food, exercise, or sleep data with health coaches or nutritionists to find opportunities for change, and patients with irritable bowel syndrome (IBS) often gather food and symptom data as part of working with providers to diagnose and manage symptoms. However, a lack of effective support often prevents health experts from reviewing large amounts of data in time-constrained visits, prevents focusing on individual goals, and prevents generating correct, individualized, and actionable recommendations. To examine how to design photo-based diaries to help people and health experts exchange knowledge and focus on collaboration goals when reviewing the data together, we designed and developed Foodprint, a photo-based food diary. Foodprint includes three components: (1) A mobile app supporting lightweight data collection, (2) a web app with photo-based visualization and quantitative visualizations supporting collaborative reflection, and (3) a pre-visit note communicating an individual's expectations and questions to experts. We deployed Foodprint in two studies: (1) with 17 people with healthy eating goals and 7 health experts, and (2) with 16 IBS patients and 8 health experts. Building upon the lens of boundary negotiating artifacts and findings from two field studies, our research contributes design principles to (1) prepare individuals to collect data relevant to their health goals and for collaboration, (2) help health experts focus on an individual's eating context, experiences, and goals in collaborative review, and (3) support individuals and experts to develop individualized, actionable plans and strategies.","Volume 3 Issue 1, March 2019"
7,10.1145/3314395,"Afsaneh Doryab, Anind K. Dey, Grace Kao, Carissa Low",Modeling Biobehavioral Rhythms with Passive Sensing in the Wild: A Case Study to Predict Readmission Risk after Pancreatic Surgery,"Biobehavioral rhythms are associated with numerous health and life outcomes. We study the feasibility of detecting rhythms in data that is passively collected from Fitbit devices and using the obtained model parameters to predict readmission risk after pancreatic surgery. We analyze data from 49 patients who were tracked before surgery, in hospital, and after discharge. Our analysis produces a model of individual patients' rhythms for each stage of treatment that is predictive of readmission. All of the rhythm-based models outperform the traditional approaches to readmission risk stratification that uses administrative data.","Volume 3 Issue 1, March 2019"
8,10.1145/3314396,"Hendrik Engelbrecht, Stephan G. Lukosch, Dragos Datcu",Evaluating the Impact of Technology Assisted Hotspot Policing on Situational Awareness and Task-Load,"Everyday field work of a police officer requires the perception, filtering and understanding of large amounts of information in highly dynamic situations. This presents opportunities for ICT to alleviate strain on officers by providing adequate information provisioning. We evaluate the usage of a mobile location-based hotspot policing system, comprised of a smartphone, smartwatch and a web-application, during real field work with officers in high and low hotspot density locations. We use a repeated measures design to compare possible effects with our baseline measure, i.e. field work without using the system. Usability, task-load and situational awareness (SA), as well as possible mediators, are evaluated to gain insight into the differences between modes of transportation and the overall viability of the system itself. No significant difference was found between the two locations. Officers using the system scored high on usability measures and interview feedback was largely positive. Measures on SA remained stable throughout baseline and experimental shifts. Task-load was significantly higher with the use of the system. The contradiction in these findings can be explained by showing the differences in the nature of field work with and without the system.","Volume 3 Issue 1, March 2019"
9,10.1145/3314397,"Mikhail Fomichev, Max Maass, Lars Almon, Alejandro Molina, Matthias Hollick",Perils of Zero-Interaction Security in the Internet of Things,"The Internet of Things (IoT) demands authentication systems which can provide both security and usability. Recent research utilizes the rich sensing capabilities of smart devices to build security schemes operating without human interaction, such as zero-interaction pairing (ZIP) and zero-interaction authentication (ZIA). Prior work proposed a number of ZIP and ZIA schemes and reported promising results. However, those schemes were often evaluated under conditions which do not reflect realistic IoT scenarios. In addition, drawing any comparison among the existing schemes is impossible due to the lack of a common public dataset and unavailability of scheme implementations.
In this paper, we address these challenges by conducting the first large-scale comparative study of ZIP and ZIA schemes, carried out under realistic conditions. We collect and release the most comprehensive dataset in the domain to date, containing over 4250 hours of audio recordings and 1 billion sensor readings from three different scenarios, and evaluate five state-of-the-art schemes based on these data. Our study reveals that the effectiveness of the existing proposals is highly dependent on the scenario they are used in. In particular, we show that these schemes are subject to error rates between 0.6% and 52.8%.","Volume 3 Issue 1, March 2019"
10,10.1145/3314398,"Chen Gao, Chao Huang, Yue Yu, Huandong Wang, Yong Li, Depeng Jin",Privacy-preserving Cross-domain Location Recommendation,"Cross-domain recommendation is a typical solution for data sparsity and cold start issue in the field of location recommendation. Specifically, data of an auxiliary domain is leveraged to improve the recommendation of the target domain. There is a typical scenario that two interaction domains (location based check-in service, for example) combine data to perform the cross-domain location recommendation task. Existing approaches are based on the assumption that the interaction data from the auxiliary domain can be directly shared across domains. However, such an assumption is not reasonable, since in the real world those domains may be operated by different companies. Therefore, directly sharing raw data may violate business privacy policy and increase the risk of privacy leakage since the user-location interaction records are very sensitive.
In this paper, we propose a framework named privacy-preserving cross-domain location recommendation which works in two stages. First, for the interaction data from the auxiliary domain, we adopt a differential privacy based protection mechanism to hide the real locations of each user to meet the criterion of differential privacy. Then we share the protected user-location interaction to the target domain. Second, we develop a new method of Confidence-aware Collective Matrix Factorization (CCMF) to effectively exploit the transferred interaction data. To verify its efficacy, we collect two real-world datasets suitable for the task. Extensive experiments demonstrate that our proposed framework achieves the best performance compared with the state-of-the-art baseline methods. We further demonstrate that our method can alleviate the data sparsity issue significantly while protecting users' location privacy.","Volume 3 Issue 1, March 2019"
11,10.1145/3314399,"Yan Gao, Yang Long, Yu Guan, Anna Basu, Jessica Baggaley, Thomas Ploetz","Towards Reliable, Automated General Movement Assessment for Perinatal Stroke Screening in Infants Using Wearable Accelerometers","Perinatal stroke (PS) is a serious condition that, if undetected and thus untreated, often leads to life-long disability, in particular Cerebral Palsy (CP). In clinical settings, Prechtl's General Movement Assessment (GMA) can be used to classify infant movements using a Gestalt approach, identifying infants at high risk of developing PS. Training and maintenance of assessment skills are essential and expensive for the correct use of GMA, yet many practitioners lack these skills, preventing larger-scale screening and leading to significant risks of missing opportunities for early detection and intervention for affected infants. We present an automated approach to GMA, based on body-worn accelerometers and a novel sensor data analysis method--Discriminative Pattern Discovery (DPD)--that is designed to cope with scenarios where only coarse annotations of data are available for model training. We demonstrate the effectiveness of our approach in a study with 34 newborns (21 typically developing infants and 13 PS infants with abnormal movements). Our method is able to correctly recognise the trials with abnormal movements with at least the accuracy that is required by newly trained human annotators (75%), which is encouraging towards our ultimate goal of an automated PS screening system that can be used population-wide.","Volume 3 Issue 1, March 2019"
12,10.1145/3314400,"Shkurta Gashi, Elena Di Lascio, Silvia Santini",Using Unobtrusive Wearable Sensors to Measure the Physiological Synchrony Between Presenters and Audience Members,"The widespread adoption of mobile and wearable devices enables new approaches for the unobtrusive and continuous monitoring of humans' behavior, physiological state, interactions and more. Within this line of research, we focus on the physiological synchrony between a presenter and her audience and investigate whether it can be used to characterize the experience of presenters and audience members during presentations. To this end, we collect data from 17 presenters and six audience members during a two-days conference. For 40, unique presenter-audience pairs we gather electrodermal activity (EDA) signals and self-reports on different aspects of the experience: engagement, immersion and enjoyment/satisfaction. For 28 of these pairs, we also collect inter-beat interval (IBI) traces. We then apply seven approaches for measuring the synchrony of physiological signals and we contextualize these measures using metrics derived from the self-reports. We find that physiological synchrony -- measured using the Dynamic Time Warping algorithm -- can be used as a proxy to quantify participants' agreement on self-reported engagement. Our findings can be used to provide automated presenter-audience feedback in a conference setting and may be applicable in other scenarios, including education (teacher-student), arts (performer-audience), or meetings (presenter-audience).","Volume 3 Issue 1, March 2019"
13,10.1145/3314401,"Milan Jain, Mridula Gupta, Amarjeet Singh, Vikas Chandan",Beyond Control: Enabling Smart Thermostats for Leakage Detection,"Smart thermostats, with multiple sensory abilities, are becoming pervasive and ubiquitous, in both residential and commercial buildings. By analyzing occupants' behavior, adjusting set temperature automatically, and adapting to temporal and spatial changes in the atmosphere, smart thermostats can maximize both - energy savings and user comfort. In this paper, we study smart thermostats for refrigerant leakage detection. Retail outlets, such as milk-booths and quick service restaurants set up cold-rooms to store perishable items. In each room, a refrigeration unit (akin to air-conditioners) is used to maintain a suitable temperature for the stored products. Often, refrigerant leaks through the coils (or valves) of the refrigeration unit which slowly diminishes the cooling capacity of the refrigeration unit while allowing it to be functional. Such leaks waste significant energy, risk occupants' health, and impact the quality of stored perishable products. While store managers usually fail to sense the early symptoms of such leaks, current techniques to report refrigerant leakage are often not scalable. We propose Greina - to continuously monitor the readily available ambient information from the thermostat and timely report such leaks. We evaluate our approach on 74 outlets of a retail enterprise and results indicate that Greina can report the leakage a week in advance when compared to manual reporting.","Volume 3 Issue 1, March 2019"
14,10.1145/3314402,"Shenggong Ji, Yu Zheng, Zhaoyuan Wang, Tianrui Li",A Deep Reinforcement Learning-Enabled Dynamic Redeployment System for Mobile Ambulances,"Protecting citizens' lives from emergent accidents (e.g. traffic accidents) and diseases (e.g. heart attack) is of vital importance in urban computing. Every day many people are caught in emergent accidents or diseases and thus need ambulances to transport them to hospitals. In this paper, we propose a dynamic ambulance redeployment system to reduce the time needed for ambulances to pick up patients and to increase the probability of patients being saved in time. For patients in danger, every second counts. Specifically, whenever there is an ambulance becoming available (e.g. finishing transporting a patient to a hospital), our dynamic ambulance redeployment system will redeploy it to a proper ambulance station such that it can better pick up future patients. However, the dynamic ambulance redeployment is challenging, as when we redeploy an available ambulance we need to simultaneously consider each station's multiple dynamic factors. To trade off these multiple factors using handcrafted rules are almost impossible. To deal with this issue, we propose using a deep neural network, called deep score network, to balance each station's dynamic factors into one score, leveraging the excellent representation ability of deep neural networks. And then we propose a deep reinforcement learning framework to learn the deep score network. Finally, based on the learned deep score network, we provide an effective dynamic ambulance redeployment algorithm. Experiment results using data collected in real world show clear advantages of our method over baselines, e.g. comparing with baselines, our method can save ~100 seconds (~20%) of average pickup time of patients and improve the ratio of patients being picked up within 10 minutes from 0.786 to 0.838. With our method, people in danger can be better saved.","Volume 3 Issue 1, March 2019"
15,10.1145/3314403,"Jaejeung Kim, Hayoung Jung, Minsam Ko, Uichin Lee",GoalKeeper: Exploring Interaction Lockout Mechanisms for Regulating Smartphone Use,"Many people often experience difficulties in achieving behavioral goals related to smartphone use. Most of prior studies approached this problem with various behavior change strategies such as self-reflection and social support. However, little is known about the effectiveness and user experiences of restrictive and coercive interventions such as blocking. In this work, we developed ""GoalKeeper,"" a smartphone intervention app that locks the user into the self-defined daily use time limit with restrictive intervention mechanisms. We conducted a four-week field experiment with 36 participants to investigate the effects and user experiences of varying intensities of restrictive interventions. The results showed that restrictive mechanisms are more effective than non-restrictive mechanisms such as warning. However, we found that restrictive mechanisms caused more frustration and pressure to the users, mainly due to diversity of usage contexts and needs. Based on our study results, we extracted practical implications for designing restrictive mechanisms that balance the intervention effectiveness for behavioral changes and the flexibility for user acceptability.","Volume 3 Issue 1, March 2019"
