,doi,authors,title,abstract,issue
312,10.1145/3130919,"Weixi Gu, Yuxun Zhou, Zimu Zhou, Xi Liu, Han Zou, Pei Zhang, Costas J. Spanos, Lin Zhang",SugarMate: Non-intrusive Blood Glucose Monitoring with Smartphones,"Inferring abnormal glucose events such as hyperglycemia and hypoglycemia is crucial for the health of both diabetic patients and non-diabetic people. However, regular blood glucose monitoring can be invasive and inconvenient in everyday life. We present SugarMate, a first smartphone-based blood glucose inference system as a temporary alternative to continuous blood glucose monitors (CGM) when they are uncomfortable or inconvenient to wear. In addition to the records of food, drug and insulin intake, it leverages smartphone sensors to measure physical activities and sleep quality automatically. Provided with the imbalanced and often limited measurements, a challenge of SugarMate is the inference of blood glucose levels at a fine-grained time resolution. We propose Md3RNN, an efficient learning paradigm to make full use of the available blood glucose information. Specifically, the newly designed grouped input layers, together with the adoption of a deep RNN model, offer an opportunity to build blood glucose models for the general public based on limited personal measurements from single-user and grouped-users perspectives. Evaluations on 112 users demonstrate that Md3RNN yields an average accuracy of 82.14%, significantly outperforming previous learning methods those are either shallow, generically structured, or oblivious to grouped behaviors. Also, a user study with the 112 participants shows that SugarMate is acceptable for practical usage.","Volume 1 Issue 3, September 2017"
313,10.1145/3130920,"Bin Guo, Yi Ouyang, Cheng Zhang, Jiafan Zhang, Zhiwen Yu, Di Wu, Yu Wang",CrowdStory: Fine-Grained Event Storyline Generation by Fusion of Multi-Modal Crowdsourced Data,"Event summarization based on crowdsourced microblog data is a promising research area, and several researchers have recently focused on this field. However, these previous works fail to characterize the fine-grained evolution of an event and the rich correlations among posts. The semantic associations among the multi-modal data in posts are also not investigated as a means to enhance the summarization performance. To address these issues, this study presents CrowdStory, which aims to characterize an event as a fine-grained, evolutionary, and correlation-rich storyline. A crowd-powered event model and a generic event storyline generation framework are first proposed, based on which a multi-clue--based approach to fine-grained event summarization is presented. The implicit human intelligence (HI) extracted from visual contents and community interactions is then used to identify inter-clue associations. Finally, a cross-media mining approach to selective visual story presentation is proposed. The experiment results indicate that, compared with the state-of-the-art methods, CrowdStory enables fine-grained event summarization (e.g., dynamic evolution) and correctly identifies up to 60% strong correlations (e.g., causality) of clues. The cross-media approach shows diversity and relevancy in visual data selection.","Volume 1 Issue 3, September 2017"
314,10.1145/3130921,"Seongmin Ham, Jihyung Lee, Kyunghan Lee",QuickTalk: An Association-Free Communication Method for IoT Devices in Proximity,"IoT devices are in general considered to be straightforward to use. However, we find that there are a number of situations where the usability becomes poor. The situations include but not limited to the followings: 1) when initializing an IoT device, 2) when trying to control an IoT device which is initialized by another person, and 3) when trying to control an IoT device out of many of the same type. We tackle these situations by proposing a new association-free communication method, QuickTalk. QuickTalk lets a user device such as a smartphone pinpoint and activate an IoT device with the help of an IR transmitter and communicate with the pinpointed IoT device through the broadcast channel of WiFi without a conventional association process. This nature, QuickTalk allows a user device to immediately give a command to a specific IoT device in proximity even when the IoT device is uninitialized, unassociated with the control interface of the user, or associated but visually indistinguishable from others of the same kind. Our experiments of QuickTalk implemented on Raspberry Pi 2 devices show that QuickTalk does its job quickly and intuitively. The end-to-end delay of QuickTalk for transmitting an IoT command is on average about 0.74 seconds, and is upper bounded by 2.5 seconds. We further confirm that even when an IoT device has ongoing data sessions with other devices, which disturb the broadcast channel, QuickTalk can still reliably communicate with the IoT device at the cost of minor throughput degradation.","Volume 1 Issue 3, September 2017"
315,10.1145/3130922,"Tian Hao, Chongguang Bi, Guoliang Xing, Roxane Chan, Linlin Tu",MindfulWatch: A Smartwatch-Based System For Real-Time Respiration Monitoring During Meditation,"With a wealth of scientifically proven health benefits, meditation was enjoyed by about 18 million people in the U.S. alone, as of 2012. Yet, there remains a stunning lack of convenient tools for promoting long-term and effective meditation practice. In this paper, we present MindfulWatch, a practical smartwatch-based sensing system that monitors respiration in real-time during meditation -- offering essential biosignals that can potentially be used to empower various future applications such as tracking changes in breathing pattern, offering real-time guidance, and providing an accurate bio-marker for meditation research. To this end, MindfulWatch is designed to be convenient for everyday use with no training required. Operating solely on a smartwatch, MindfulWatch can immediately reach the growing population of smartwatch users, making it ideal for longitudinal data collection for meditation studies. Specifically, it utilizes motion sensors to sense the subtle “micro” wrist rotation (0.01 rad/s) induced by respiration. To accurately capture breathing, we developed a novel self-adaptive model that tracks changes in both breathing pattern and meditation posture over time. MindfulWatch was evaluated based on data from 36 real-world meditation sessions (8.7 hours, 11 subjects). The results suggest that MindfulWatch offers reliable real-time respiratory timing measurement (70% errors under 0.5 seconds).","Volume 1 Issue 3, September 2017"
316,10.1145/3132024,"Christian Holz, Edward J. Wang",Glabella: Continuously Sensing Blood Pressure Behavior using an Unobtrusive Wearable Device,"We propose Glabella, a wearable device that continuously and unobtrusively monitors heart rates at three sites on the wearer’s head. Our glasses prototype incorporates optical sensors, processing, storage, and communication components, all integrated into the frame to passively collect physiological data about the user without the need for any interaction. Glabella continuously records the stream of reflected light intensities from blood flow as well as inertial measurements of the user’s head. From the temporal differences in pulse events across the sensors, our prototype derives the wearer’s pulse transit time on a beat-to-beat basis.
Numerous efforts have found a significant correlation between a person’s pulse transit time and their systolic blood pressure. In this paper, we leverage this insight to continuously observe pulse transit time as a proxy for the behavior of systolic blood pressure levels—at a substantially higher level of convenience and higher rate than traditional blood pressure monitors, such as cuff-based oscillometric devices. This enables our prototype to model the beat-to-beat fluctuations in the user’s blood pressure over the course of the day and record its short-term responses to events, such as postural changes, exercise, eating and drinking, resting, medication intake, location changes, or time of day.
During our in-the-wild evaluation, four participants wore a custom-fit Glabella prototype device over the course of five days throughout their daytime job and regular activities. Participants additionally measured their radial blood pressure three times an hour using a commercial oscillometric cuff. Our analysis shows a high correlation between the pulse transit times computed on our devices with participants’ heart rates (mean r = 0.92, SE = 0.03, angular artery) and systolic blood pressure values measured using the oscillometric cuffs (mean r = 0.79, SE = 0.15, angular-superficial temporal artery, considering participants’ self-administered cuff-based measurements as ground truth). Our results indicate that Glabella has the potential to serve as a socially-acceptable capture device, requiring no user input or behavior changes during regular activities, and whose continuous measurements may prove informative to physicians as well as users’ self-tracking activities.","Volume 1 Issue 3, September 2017"
317,10.1145/3130924,"Chen-Yu Hsu, Aayush Ahuja, Shichao Yue, Rumen Hristov, Zachary Kabelac, Dina Katabi",Zero-Effort In-Home Sleep and Insomnia Monitoring using Radio Signals,"Insomnia is the most prevalent sleep disorder in the US. In-home insomnia monitoring is important for both diagnosis and treatment. Existing solutions, however, require the user to either maintain a sleep diary or wear a sensor while sleeping. Both can be quite cumbersome. This paper introduces EZ-Sleep, a new approach for monitoring insomnia and sleep. EZ-Sleep has three properties. First, it is zero effort, i.e., it neither requires the user to wear a sensor nor to record any data. It monitors the user remotely by analyzing the radio signals that bounce off her body. Second, it delivers new features unavailable with other devices such as automatically detecting where the user sleeps and her exact bed schedule, while simultaneously monitoring multiple users in different beds. Third, it is highly accurate. Its average error in measuring sleep latency and total sleep time is 4.9 min and 10.3 min, respectively.","Volume 1 Issue 3, September 2017"
318,10.1145/3131892,"Hayeon Jeong, Heepyung Kim, Rihun Kim, Uichin Lee, Yong Jeong",Smartwatch Wearing Behavior Analysis: A Longitudinal Study,"Smartwaches are the representative wearable or body-worn devices that provide convenient and easy information access. There is a growing body of research work on enabling novel interaction techniques and understanding user experiences of smartwatches. However, there is still lack of user experience research on wearing behaviors of smartwatches, which is critical for wearable device and service design. In this work, we investigate how college students wear smartwatches and what factors affect wearing behaviors by analyzing a longitudinal activity dataset collected from 50 smartwatch users for 203 days. Our results show that there are several temporal usage patterns and distinct groups of usage patterns. The factors affecting wearing behaviors are contextual, nuanced, and multifaceted. Our findings provide diverse design implications for improving wearability of smartwatches and leveraging smartwatches for behavioral changes.","Volume 1 Issue 3, September 2017"
319,10.1145/3130926,"Avinash Kalyanaraman, Dezhi Hong, Elahe Soltanaghaei, Kamin Whitehouse",Forma Track: Tracking People based on Body Shape,"Knowledge of a person’s whereabouts in the home is key to context-aware applications, but many people do not want to carry or wear a tag or mobile device in the home. Therefore, many tracking systems are now using so-called weak biometrics such as height, weight, and width. In this paper, we propose to use body shape as a weak biometric, differentiating people based on features such as head size, shoulder size, or torso size. The basic idea is to scan the body with a radar sensor and to compute the reflection profile: the amount of energy that reflects back from each part of the body. Many people have different body shapes even if they have the same height, weight, or width, which makes body shape a stronger biometric. We built a proof-of-concept system called FormaTrack to test this approach, and evaluate using eight participants of varying height and weight. We collected over 2800 observations while capturing a wide range of factors such as clothing, hats, shoes, and backpacks. Results show that FormaTrack can achieve a precision, recall, direction and identity accuracy (over all possible groups of 2 people) of 100%, 99.86%, 99.7% and 95.3% respectively. Results indicate that FormaTrack can achieve over 99% tracking accuracy with 2 people in a home with 5 or more rooms.","Volume 1 Issue 3, September 2017"
320,10.1145/3130927,"Aftab Khan, James Nicholson, Thomas Plötz",Activity Recognition for Quality Assessment of Batting Shots in Cricket using a Hierarchical Representation,"Quality assessment in cricket is a complex task that is performed by understanding the combination of individual activities a player is able to perform and by assessing how well these activities are performed. We present a framework for inexpensive and accessible, automated recognition of cricketing shots. By means of body-worn inertial measurement units, movements of batsmen are recorded, which are then analysed using a parallelised, hierarchical recognition system that automatically classifies relevant categories of shots as required for assessing batting quality. Our system then generates meaningful visualisations of key performance parameters, including feet positions, attack/defence, and distribution of shots around the ground. These visualisations are the basis for objective skill assessment thereby focusing on specific personal improvement points as identified through our system. We evaluated our framework through a deployment study where 6 players engaged in batting exercises. Based on the recorded movement data we could automatically identify 20 classes of unique batting shot components with an average F1-score greater than 88%. This analysis is the basis for our detailed analysis of our study participants’ skills. Our system has the potential to rival expensive vision-based systems but at a fraction of the cost.","Volume 1 Issue 3, September 2017"
321,10.1145/3130928,"Inyeop Kim, Gyuwon Jung, Hayoung Jung, Minsam Ko, Uichin Lee",Let’s FOCUS: Mitigating Mobile Phone Use in College Classrooms,"With the increasingly frequent appearance of mobile phones in college classrooms, there have been growing concerns regarding their negative aspects including distractive off-task multitasking. In this work, we design and evaluate Let’s FOCUS, a software-based intervention service that assists college students in self-regulating their mobile phone use in classrooms. Our preliminary survey study (with 47 professors and 283 students) reveals that it is critical to encourage voluntary participation by framing intervention as a learning tool and to raise awareness regarding appropriate mobile phone usage by establishing social norms in colleges. Let’s FOCUS introduces a virtual limiting space for each class (or a virtual classroom) where the students can explicitly restrict their mobile phone use voluntarily. Furthermore, it promotes students’ willing participation by leveraging social facilitation and context-aware reminders associated with virtual classrooms. We conducted a campus-wide campaign for approximately six weeks to evaluate the feasibility of the proposed approach. The results confirm that 379 students used the app to limit 9,335 hours of mobile phone usage over 233 classrooms. Let’s FOCUS was used in diverse learning contexts and for different purposes and its social learning and context-awareness features significantly motivated prolonged participation. We present the design considerations of software-based intervention.","Volume 1 Issue 3, September 2017"
322,10.1145/3130932,"Jaejeung Kim, Chiwoo Cho, Uichin Lee",Technology Supported Behavior Restriction for Mitigating Self-Interruptions in Multi-device Environments,"The interruptions people experience may be initiated from digital devices but also from oneself, an action which is termed “self-interruption.” Prior work mostly focused on understanding work-related self-interruptions and designing tools for mitigating them in work contexts. However, self-interruption to off-tasks (e.g., viewing social networking sites, and playing mobile games) has received little attention in the HCI community thus far. We conducted a formative study about self-interruptions to off-tasks and coping strategies in multi-device working environments. Off-task usage was considered a serious roadblock to productivity, and yet, the habitual usage and negative triggers made it challenging to manage off-task usage. To mitigate these concerns, we developed “PomodoLock,” a self-interruption management tool that allows users voluntarily to set a timer for a fixed period, during which it selectively blocks interruption sources across multiple devices. To understand the effect of restricting access to self-interruptive sources such as applications and websites, we conducted a three-week field trial (n=40) where participants were asked to identify disrupting apps and sites to be blocked, but the multi-device blocking feature was only provided to the experimental group. Our study results showed the perceived coercion and the stress of the experimental group were lower despite its behavioral restriction with multi-device blocking. Qualitative study results from interviews and surveys confirm that multi-device blocking significantly reduced participants’ mental effort for managing self-interruptions, thereby leading to a reduction in the overall stress level. The findings suggest that when the coerciveness of behavioral restriction is appropriately controlled, coercive design can positively assist users in achieving their goals.","Volume 1 Issue 3, September 2017"
323,10.1145/3131893,"Keunseo Kim, Hengameh Zabihi, Heeyoung Kim, Uichin Lee",TrailSense: A Crowdsensing System for Detecting Risky Mountain Trail Segments with Walking Pattern Analysis,"Trail surface information is critical in preventing from the mountain accidents such as falls and slips. In this paper, we propose a new mobile crowdsensing system that automatically infers whether trail segments are risky to climb by using sensor data collected from multiple hikers’ smartphones. We extract cyclic gait-based features from walking motion data to train machine learning models, and multiple hikers’ results are then aggregated for robust classification. We evaluate our system with two real-world datasets. First, we collected data from 14 climbers for a mountain trail which includes 13 risky segments. The average accuracy of individuals is approximately 80%, but after clustering the results, our system can accurately identify all the risky segments. We then collected an additional dataset from five climbers in two different mountain trails, which have 10 risky segments in total. Our results show that the model trained in one trail can be used to accurately identify all the risky segments in the other trail, which documents the generalizability of our system.","Volume 1 Issue 3, September 2017"
324,10.1145/3130931,"Lawrence H. Kim, Sean Follmer",UbiSwarm: Ubiquitous Robotic Interfaces and Investigation of Abstract Motion as a Display,"As robots increasingly enter our everyday life, we envision a future in which robots are ubiquitous and interact with both ourselves and our environments. This paper introduces the concept of ubiquitous robotic interfaces (URIs), multi-robot interfaces capable of mobility, manipulation, sensing, display and interaction. URIs interact directly with the user and indirectly through surrounding objects. A key aspect of URIs is their ability to display information to users either by collectively forming shapes or through their movements. In this paper, we focus on the use of URIs to display information in ubiquitous settings. We first investigate the use of abstract motion as a display for URIs by studying human perception of abstract multi-robot motion. With ten small robots, we produced 42 videos of bio-inspired abstract motion by varying three parameters (7 x 2 x 3): bio-inspired behavior, speed and smoothness. In a crowdsourced between-subjects study, 1067 subjects were recruited to watch the videos and describe their perception through Likert scales and free text. Study results suggest that different bio-inspired behaviors elicit significantly different responses in arousal, dominance, hedonic and pragmatic qualities, animacy, urgency and willingness to attend. On the other hand, speed significantly affects valence, arousal, hedonic quality, urgency and animacy while smoothness affects hedonic quality, animacy, attractivity and likeability. We discuss how these results inform URI designers to formulate appropriate motion for different interaction scenarios and use these results to derive our own example applications using our URI platform, UbiSwarm.","Volume 1 Issue 3, September 2017"
325,10.1145/3130930,"Young-Ho Kim, Jae Ho Jeon, Bongshin Lee, Eun Kyoung Choe, Jinwook Seo",OmniTrack: A Flexible Self-Tracking Approach Leveraging Semi-Automated Tracking,"We now see an increasing number of self-tracking apps and wearable devices. Despite the vast number of available tools, however, it is still challenging for self-trackers to find apps that suit their unique tracking needs, preferences, and commitments. Furthermore, people are bounded by the tracking tools’ initial design because it is difficult to modify, extend, or mash up existing tools. In this paper, we present OmniTrack, a mobile self-tracking system, which enables self-trackers to construct their own trackers and customize tracking items to meet their individual tracking needs. To inform the OmniTrack design, we first conducted semi-structured interviews (N = 12) and analyzed existing mobile tracking apps (N = 62). We then designed and developed OmniTrack as an Android mobile app, leveraging a semi-automated tracking approach that combines manual and automated tracking methods. We evaluated OmniTrack through a usability study (N = 10) and improved its interfaces based on the feedback. Finally, we conducted a 3-week deployment study (N = 21) to assess if people can capitalize on OmniTrack’s flexible and customizable design to meet their tracking needs. From the study, we showed how participants used OmniTrack to create, revise, and appropriate trackers—ranging from a simple mood tracker to a sophisticated daily activity tracker. We discuss how OmniTrack positively influences and supports self-trackers’ tracking practices over time, and how to further improve OmniTrack by providing more appropriate visualizations and sharable templates, incorporating external contexts, and supporting researchers’ unique data collection needs.","Volume 1 Issue 3, September 2017"
326,10.1145/3130933,"Jarrod Knibbe, Paul Strohmeier, Sebastian Boring, Kasper Hornbæk",Automatic Calibration of High Density Electric Muscle Stimulation,"Electric muscle stimulation (EMS) can enable mobile force feedback, support pedestrian navigation, or confer object affordances. To date, however, EMS is limited by two interlinked problems. (1) EMS is low resolution -- achieving only coarse movements and constraining opportunities for exploration. (2) EMS requires time consuming, expert calibration -- confining these interaction techniques to the lab. EMS arrays have been shown to increase stimulation resolution, but as calibration complexity increases exponentially as more electrodes are used, we require heuristics or automated procedures for successful calibration. We explore the feasibility of using electromyography (EMG) to auto-calibrate high density EMS arrays. We determine regions of muscle activity during human-performed gestures, to inform stimulation patterns for EMS-performed gestures. We report on a study which shows that auto-calibration of a 60-electrode array is feasible: achieving 52% accuracy across six gestures, with 82% accuracy across our best three gestures. By highlighting the electrode-array calibration problem, and presenting a first exploration of a potential solution, this work lays the foundations for high resolution, wearable and, perhaps one day, ubiquitous EMS beyond the lab.","Volume 1 Issue 3, September 2017"
327,10.1145/3130934,"Yuki Kubo, Ryosuke Takada, Buntarou Shizuki, Shin Takahashi",Exploring Context-Aware User Interfaces for Smartphone-Smartwatch Cross-Device Interaction,"In this study, we explore context-aware cross-device interactions between a smartphone and smartwatch. We present 24 contexts, and then examine and prioritize suitable user interfaces (UIs) for each. In addition, we present example applications, including a map, notification management system, multitasking application, music player, and video chat application, each of which has its own context-aware UIs. To support these context-aware UIs, we investigate the performance of our context recognizer in which recognition is based on machine-learning using the accelerometers in a smartphone and smartwatch. We conduct seven different evaluations using four machine-learning algorithms: J48 decision tree, sequential minimal optimization (SMO)-based support vector machine (SVM), random forest, and multilayer perceptron. With each algorithm, we conduct a long-interval experiment to examine the level of accuracy at which each context is recognized using data previously collected for training. The results show that SMO-based SVM is suitable for recognizing the 24 contexts considered in this study.","Volume 1 Issue 3, September 2017"
